{
  "session_id": "SES-PERF-2026-04-14-001",
  "user_goal": "Registrar formalmente en la documentación los resultados recientes de stress y los presets operativos de performance",
  "task_type": "system_change",
  "selected_workflow": "workflow_system_change",
  "roles_activated": [
    "role_master_bago",
    "role_orchestrator",
    "role_architect",
    "role_validator",
    "role_canonical_auditor"
  ],
  "status": "completed",
  "artifacts": [
    "tools/perf/README.md",
    "docs/DECISIONES.md",
    "state/global_state.json",
    "state/changes/BAGO-CHG-028.json",
    "state/evidences/BAGO-EVD-028.json",
    "state/sessions/SES-PERF-2026-04-14-001.json",
    "TREE.txt",
    "CHECKSUMS.sha256"
  ],
  "decisions": [
    "Documentar en README de perf los runs recientes realmente relevantes y no solo el uso de herramientas",
    "Fijar en DECISIONES los presets operativos recomendados para github_models",
    "Registrar el endurecimiento documental como cambio nativo adicional"
  ],
  "created_at": "2026-04-14T00:36:00Z",
  "updated_at": "2026-04-14T00:36:00Z"
}
