{
  "session_id": "SES-CORR-2026-04-11-001",
  "task_type": "system_change",
  "selected_workflow": "workflow_system_change",
  "roles_activated": [
    "role_master_bago",
    "role_orchestrator",
    "role_architect",
    "role_generator",
    "role_organizer",
    "role_validator",
    "role_canonical_auditor"
  ],
  "status": "completed",
  "summary": "Corrección del pack línea canónica previa a partir de auditoría crítica: resolubilidad del manifiesto, regeneración del árbol final, migración histórica material y densificación de auxiliares.",
  "artifacts": [
    "pack.json",
    "TREE.txt",
    "CHECKSUMS.sha256",
    "docs/migration/MIGRACION_V1_A_V2_1_CORREGIDA.md"
  ],
  "decisions": [
    "rutas relativas desde pack.json",
    "migración fiel de historia v1",
    "preservación de originales",
    "añadir herramientas ligeras de validación"
  ],
  "created_at": "2026-04-11T12:30:00Z",
  "updated_at": "2026-04-11T12:30:00Z"
}
