{
  "session_id": "SES-CON-2026-04-11-001",
  "user_goal": "Consolidar la 2.2 híbrida en una 2.2.1 plenamente integrada",
  "task_type": "system_change",
  "selected_workflow": "workflow_system_change",
  "roles_activated": [
    "role_master_bago",
    "role_orchestrator",
    "role_architect",
    "role_generator",
    "role_organizer",
    "role_validator",
    "role_canonical_auditor",
    "role_vertice"
  ],
  "status": "completed",
  "artifacts": [
    "README.md",
    "AGENT_START.md",
    "docs/operation/INSTALACION.md",
    "core/workflows/workflow_bootstrap_repo_first.md",
    "core/canon/REGLAS_DE_ACTIVACION.md",
    "core/orchestrator/ORQUESTADOR_CENTRAL.md",
    "core/orchestrator/ROUTER_DE_ROLES.md",
    "core/orchestrator/MATRIZ_DE_ENRUTADO.md"
  ],
  "decisions": [
    "Limpiar identidad interna a 2.2.1",
    "Integrar repo-first en el núcleo",
    "Volver a hacer .bago autocontenida",
    "Endurecer validación contra deriva de versión"
  ],
  "created_at": "2026-04-11T15:00:00Z",
  "updated_at": "2026-04-11T15:00:00Z"
}
