{
  "session_id": "SES-BTS-2026-04-14-001",
  "task_type": "project_bootstrap",
  "selected_workflow": "workflow_bootstrap_repo_first",
  "roles_activated": ["role_adaptador_proyecto", "role_iniciador_maestro", "role_orchestrator"],
  "user_goal": "Arrancar BAGO en modo repo-first usando workflow_bootstrap_repo_first y dejar continuidad operativa lista.",
  "summary": "Bootstrap repo-first completado sobre BAGO_AMTEC_V2_2_2_OFICIAL_utf8. Repo clasificado como sistema BAGO autocontenido (no aplicación de negocio), con stack documental/operativo (.md/.json + scripts sh/bat/ps1 y validadores Python). Contexto suficiente cargado para orquestación.",
  "status": "closed",
  "artifacts": [
    ".bago/AGENT_START.md",
    ".bago/state/global_state.json",
    ".bago/core/00_CEREBRO_BAGO.md",
    ".bago/core/workflows/workflow_bootstrap_repo_first.md",
    ".bago/agents/ADAPTADOR_PROYECTO.md",
    ".bago/agents/INICIADOR_MAESTRO.md",
    ".bago/core/orchestrator/ORQUESTADOR_CENTRAL.md",
    ".bago/state/sessions/SES-BTS-2026-04-14-001.json"
  ],
  "decisions": [
    "Aplicar Ruta A de AGENT_START.md por tratarse de trabajo sobre repositorio real.",
    "Clasificar el repositorio como sistema BAGO/paquete operativo (sin código app tradicional ni suite de tests de producto).",
    "Fijar modo predominante [A] Adaptativo para enrutar continuidad por workflow_analysis ante objetivo funcional aún no especificado."
  ],
  "created_at": "2026-04-14T23:24:00Z",
  "updated_at": "2026-04-14T23:24:00Z"
}
